{
  "schemaVersion": "fams.formal_release_readiness.substage_manifest_set.v1",
  "generatedAt": "2026-07-16T22:21:45+08:00",
  "stageId": "formal_release_readiness_closure",
  "currentStateSource": "docs/current-stage-state.json",
  "architectureDecision": "docs/adr/ADR-2026-07-16-formal-release-readiness-modular-monolith.md",
  "supportsControlledAutomation": true,
  "supportsUnattendedEndToEndAutomation": false,
  "supportsFormalTradingUnlock": false,
  "stageOrder": ["FTR-0", "FTR-1", "FTR-2", "FTR-3", "FTR-4", "FTR-5", "FTR-6"],
  "stages": {
    "FTR-0": {
      "stageId": "FTR-0",
      "purpose": "冻结当前已验收基线、下一阶段范围和机器状态，关闭历史状态漂移。",
      "currentImplementationState": "documentation_ready_for_human_review",
      "currentEntities": ["docs/current-stage-state.json", "docs/S0_S8_SUBSTAGE_ACCEPTANCE_MANIFESTS.json", "docs/target-architecture-gap.drawio"],
      "targetEntities": ["docs/FTR_0_FTR_6_SUBSTAGE_ACCEPTANCE_MANIFESTS.json", "docs/CURRENT_STAGE_DOCUMENTATION_CONSISTENCY_AUDIT.md"],
      "entryCriteria": ["S0-S8 accepted baseline remains immutable", "human approval for documentation development recorded"],
      "commands": [
        {"id": "state-json", "command": "node -e \"JSON.parse(require('fs').readFileSync('docs/current-stage-state.json','utf8'))\"", "availability": "existing", "requiredBeforeExit": true},
        {"id": "manifest-json", "command": "node -e \"JSON.parse(require('fs').readFileSync('docs/FTR_0_FTR_6_SUBSTAGE_ACCEPTANCE_MANIFESTS.json','utf8'))\"", "availability": "existing", "requiredBeforeExit": true},
        {"id": "manifest-contract", "command": "cd backend && npm run test:ftr-manifest-contract", "availability": "planned", "requiredBeforeExit": true},
        {"id": "drawio-read", "command": "node docs/read-drawio.mjs docs/target-architecture-gap.drawio", "availability": "existing", "requiredBeforeExit": true}
      ],
      "requiredArtifacts": ["current-stage-state.json", "CURRENT_STAGE_DOCUMENTATION_CONSISTENCY_AUDIT.md", "read-drawio-output.txt", "drawio-summary.txt"],
      "artifactSchemas": [
        {"artifact": "FTR_0_FTR_6_SUBSTAGE_ACCEPTANCE_MANIFESTS.json", "schemaPath": "docs/fams-ftr-substage-acceptance-manifest.schema.json", "availability": "existing"},
        {"artifact": "current-stage-state.json", "schemaPath": "docs/contracts/fams-current-stage-state.schema.json", "availability": "planned_in_stage"}
      ],
      "automatedGates": ["drawioPageCount=8", "currentStageAndNextStageSeparated=true", "tradeBoundaryFieldsAllFalse=true"],
      "manualGates": ["human architecture direction review", "implementation approval remains pending"],
      "userAcceptanceScenarios": ["审计者打开第 1、2、8 页，可区分已完成基线、下一阶段实体、剩余风险和禁止声明。"],
      "exitClaims": ["formalReleaseReadinessDocumentationReady=true", "formalTradingReleaseReviewReady=false"],
      "rollbackConditions": ["historical S0-S8 shown as pending", "target service shown as already implemented", "trading unlock field becomes true"],
      "exitCodePolicy": {"allCommandsMustExitZero": true, "blockedGateExitCode": 2, "failedGateExitCode": 1}
    },
    "FTR-1": {
      "stageId": "FTR-1",
      "purpose": "把研究/免费源数据升级为字段级可授权、可追溯、可判定的正式数据证据。",
      "currentImplementationState": "contract_implemented_business_gate_blocked",
      "currentEntities": ["formalProviderIngestionService", "marketDataFreshnessService", "PortfolioBacktestEngine.buildDataGovernanceAudit", "15_data_governance_audit.json"],
      "targetEntities": ["FormalDataProviderService", "FormalDataFreshnessPolicy", "FieldEvidenceValidator", "FormalDataSnapshot"],
      "entryCriteria": ["FTR-0 passed", "provider authorization owner identified", "releaseCandidateStrategyIds fixed"],
      "commands": [
        {"id": "data-governance", "command": "cd backend && npm run test:fams-data-governance", "availability": "existing_requires_ftr_extension", "requiredBeforeExit": true},
        {"id": "asset-sample", "command": "cd backend && npm run test:portfolio-asset-sample-revalidation", "availability": "existing", "requiredBeforeExit": true}
      ],
      "requiredArtifacts": ["15_data_governance_audit.json", "provider_authorization_audit.json", "field_evidence_validation_audit.json"],
      "artifactSchemas": [
        {"artifact": "15_data_governance_audit.json", "schemaPath": "docs/contracts/ftr-1-data-governance-audit.schema.json", "availability": "planned_in_stage"},
        {"artifact": "provider_authorization_audit.json", "schemaPath": "docs/contracts/ftr-1-provider-authorization-audit.schema.json", "availability": "planned_in_stage"},
        {"artifact": "field_evidence_validation_audit.json", "schemaPath": "docs/contracts/ftr-1-field-evidence-validation-audit.schema.json", "availability": "planned_in_stage"}
      ],
      "automatedGates": ["noCriticalProviderUnknown=true", "criticalFieldsHaveEvidenceRefs=true", "noCriticalFreshnessUnknownOrStale=true", "noCriticalCoverageBlocked=true", "researchFallbackPromotedToFormal=false"],
      "manualGates": ["formal provider authorization verification", "data owner review"],
      "userAcceptanceScenarios": ["用户在 Backtest 查看每个 release candidate 的 provider、日期、覆盖率、跨源状态和恢复动作；Operations 可追溯相同 evidenceRefs。"],
      "exitClaims": ["formalDataGovernancePassed=true"],
      "rollbackConditions": ["free source labeled official", "critical evidence missing", "stale data hidden", "provider secret logged"],
      "exitCodePolicy": {"allCommandsMustExitZero": true, "blockedGateExitCode": 2, "failedGateExitCode": 1}
    },
    "FTR-2": {
      "stageId": "FTR-2",
      "purpose": "为 release candidate 提供官方或经授权复核的可信 total-return benchmark。",
      "currentImplementationState": "formal_review_passed_formal_trading_blocked",
      "currentEntities": ["portfolioBenchmarkService", "PortfolioBacktestEngine.buildBenchmarkQualificationAudit", "16_benchmark_qualification_audit.json"],
      "targetEntities": ["BenchmarkQualificationService", "OfficialTotalReturnBenchmarkAdapter", "TrustedTotalReturnBenchmarkAdapter"],
      "entryCriteria": ["FTR-1 provider identity available", "benchmark license or trust review owner identified"],
      "commands": [
        {"id": "benchmark-qualification", "command": "cd backend && npm run test:fams-benchmark-qualification", "availability": "existing_requires_ftr_extension", "requiredBeforeExit": true},
        {"id": "total-return-backtest", "command": "cd backend && npm run test:dividend-low-vol-total-return-backtest", "availability": "existing", "requiredBeforeExit": true}
      ],
      "requiredArtifacts": ["16_benchmark_qualification_audit.json", "benchmark_license_review.json", "benchmark_total_return_replay.json"],
      "artifactSchemas": [
        {"artifact": "16_benchmark_qualification_audit.json", "schemaPath": "docs/contracts/ftr-2-benchmark-qualification-audit.schema.json", "availability": "planned_in_stage"},
        {"artifact": "benchmark_total_return_replay.json", "schemaPath": "docs/contracts/ftr-2-benchmark-replay.schema.json", "availability": "planned_in_stage"}
      ],
      "automatedGates": ["benchmarkType in official_total_return/trusted_total_return", "benchmarkSourceRefsPresent=true", "researchProxyCannotPassFormalValidation=true", "deprecatedAliasesPersisted=false"],
      "manualGates": ["benchmark authorization or trust review"],
      "userAcceptanceScenarios": ["用户对比策略时可见 benchmark 类型、授权状态、收益曲线、分红贡献和成本拖累；免费源降级原因明确。"],
      "exitClaims": ["benchmarkQualificationPassed=true"],
      "rollbackConditions": ["free source promoted to official", "price index described as total return", "license evidence missing"],
      "exitCodePolicy": {"allCommandsMustExitZero": true, "blockedGateExitCode": 2, "failedGateExitCode": 1}
    },
    "FTR-3": {
      "stageId": "FTR-3",
      "purpose": "对明确的 release candidate 集合完成 OOS、walk-forward、参数敏感性和分组稳定性验证。",
      "currentImplementationState": "contract_implemented_status_insufficient_0_of_7_passed",
      "currentEntities": ["PortfolioBacktestEngine.buildFormalValidationAudit", "17_formal_validation_audit.json", "FORMAL_VALIDATION_METRIC_DEFINITIONS.md"],
      "targetEntities": ["FormalValidationService", "ReleaseCandidateSet", "ValidationFailureTaxonomy"],
      "entryCriteria": ["FTR-1 passed", "FTR-2 passed", "releaseCandidateStrategyIds and excludedStrategyIds recorded"],
      "commands": [
        {"id": "formal-validation", "command": "cd backend && npm run test:fams-formal-validation", "availability": "existing_requires_ftr_extension", "requiredBeforeExit": true},
        {"id": "long-horizon", "command": "cd backend && npm run test:portfolio-backtest-long-horizon", "availability": "existing", "requiredBeforeExit": true}
      ],
      "requiredArtifacts": ["17_formal_validation_audit.json", "validation_failure_taxonomy.json", "release_candidate_set.json"],
      "artifactSchemas": [
        {"artifact": "17_formal_validation_audit.json", "schemaPath": "docs/contracts/ftr-3-formal-validation-audit.schema.json", "availability": "planned_in_stage"},
        {"artifact": "release_candidate_set.json", "schemaPath": "docs/contracts/ftr-3-release-candidate-set.schema.json", "availability": "planned_in_stage"}
      ],
      "automatedGates": ["releaseEffectivePathCount>=30", "releaseEffectivePathBenchmark in official_total_return/trusted_total_return", "industryGroupCount>=3", "walkForwardWindows>=6", "walkForwardPassedRatio>=0.6", "parameterSensitivityStatus!=insufficient", "groupStabilityStatus!=insufficient", "allReleaseCandidatesPassed=true"],
      "manualGates": ["model reviewer confirms candidate set and policy thresholds"],
      "userAcceptanceScenarios": ["研究用户逐策略查看 OOS、walk-forward、参数和分组结果；失败策略不能从 candidate 集合中静默消失。"],
      "exitClaims": ["formalValidationStatus=passed", "formalValidationPassed=true"],
      "rollbackConditions": ["failed candidate excluded without reason", "invalid windows removed from insufficient count", "research proxy used for formal pass"],